Category,Update Type,Feature Name,Short Description,Full Description,Status,Date,Technical Details,User Benefits,Files Changed
Backend Setup,New,Database Setup,Set up database to store information,We set up a database to store all the information like user data and readings,Completed,2024-12-05,We used SQLite which is a simple database that works without extra setup,Users data and readings are now safely stored,backend/.env backend/db.sqlite3
Backend Setup,New,PostgreSQL Database,Set up powerful database for production,We created a script to set up a more powerful database for when the website gets bigger,Completed,2024-12-05,This is for production use when many people use the website,Website can handle more users and data,backend/reset_postgres_password.ps1
Backend Setup,New,Backend Server,Built server side of website,We built the server side of the website using Django which handles all the logic and data,Completed,2024-12-05,This includes user accounts readings numerology and astrology features,All website features work properly,backend/palmastro_backend/settings.py
Backend Setup,New,API Connections,Created connections between frontend and backend,We created all the connections between frontend and backend so they can talk to each other,Completed,2024-12-05,These are like bridges that let the website send and receive data,Frontend and backend communicate smoothly,backend/palmastro_backend/urls.py
Backend Setup,New,AI Integration,Connected OpenAI AI for palm analysis,We connected OpenAI's AI to analyze palm images and give readings,Completed,2024-12-05,The AI looks at palm photos and tells people about their future,Users get accurate AI-powered readings,backend/readings/views_palm.py
Backend Setup,New,Background Jobs,Set up system for background processing,We set up a system to do heavy work in the background so the website doesn't freeze,Completed,2024-12-05,This makes the website faster and smoother,Website doesn't freeze during heavy operations,backend/palmastro_backend/celery.py
Backend Setup,New,Task Queue,Added system to handle multiple tasks,We added a system to handle multiple tasks at the same time without slowing down,Completed,2024-12-05,Like having multiple workers doing different jobs,Multiple users can use website simultaneously,backend/readings/tasks.py
Backend Setup,New,Image Storage,Created system to save palm photos temporarily,We created a system to save palm photos temporarily and then delete them for privacy,Completed,2024-12-05,Images are automatically deleted after analysis to protect user privacy,User privacy is protected,backend/readings/views_palm.py
Backend Setup,New,Rate Limiting,Added limits to prevent spam,We added limits so people can't spam the website with too many requests,Completed,2024-12-05,This prevents abuse and keeps the website running smoothly,Website stays stable and fast,backend/numerology/throttling.py
Backend Setup,New,Login System,Built login system with secure tokens,We built a login system using secure tokens so users can access their account,Completed,2024-12-05,But we later removed this requirement so everyone can use the website,Was built but later removed,backend/accounts/views.py
Backend Setup,New,Cross-Origin Setup,Configured website communication,We configured the website so frontend and backend can communicate properly,Completed,2024-12-05,This allows the website to work correctly,Frontend and backend work together,backend/palmastro_backend/settings.py
Backend Setup,New,Configuration File,Created settings file for important information,We created a settings file to store all important information like database passwords and API keys,Completed,2024-12-05,This keeps sensitive information safe and organized,Sensitive data is secure,backend/.env
Backend Setup,New,Database Tables,Created all tables in database,We created all the tables in the database to store different types of information,Completed,2024-12-05,Like tables for users readings numerology and astrology data,All data types are properly stored,backend/accounts/models.py backend/readings/models.py
Backend Setup,New,API Documentation,Created documentation for API,We created documentation so developers can understand how to use the API,Completed,2024-12-05,This helps other developers work with our code,Developers can easily understand the API,backend/palmastro_backend/settings.py
Frontend UI,Update,Home Page,Redesigned home page for all devices,We redesigned the home page to look better and work on all devices,Completed,2024-12-05,All text sizes are now perfect - not too big not too small,Home page looks great on all devices,src/pages/Index.tsx
Frontend UI,Update,Navigation Bar,Removed Premium button and improved menu,We removed the Premium button and made the menu work better on mobile phones,Completed,2024-12-05,The menu now shows which page you're on with an underline,Easier navigation on all devices,src/components/Navbar.tsx
Frontend UI,Update,Hero Section,Made main banner smaller and compact,We made the main banner section smaller and more compact,Completed,2024-12-05,We hid heavy animations on mobile phones to make them faster,Faster loading on mobile,src/components/Hero.tsx
Frontend UI,Update,Features Section,Simplified features section,We simplified the features section and made it look cleaner,Completed,2024-12-05,Better spacing and everything fits nicely on all screen sizes,Better visual appearance,src/components/Features.tsx
Frontend UI,Update,Palm Reading Page,Completely redesigned for desktop and mobile,We completely redesigned this page to look perfect on both desktop and mobile,Completed,2024-12-05,All cards buttons and text are now properly sized,Perfect viewing on all devices,src/pages/PalmAnalysis.tsx
Frontend UI,Update,Numerology Page,Made calculator work better on mobile,We made the calculator work better on mobile and fixed all text sizes,Completed,2024-12-05,Buttons are full width on mobile so they're easier to tap,Easier to use on mobile,src/pages/Numerology.tsx
Frontend UI,Update,Astrology Page,Improved form for mobile phones,We improved the form so it works better on mobile phones,Completed,2024-12-05,The steps scroll horizontally on mobile for better viewing,Better mobile experience,src/pages/AstrologyReading.tsx
Frontend UI,Update,Dashboard Page,Redesigned dashboard for all devices,We redesigned the dashboard to look great on all devices,Completed,2024-12-05,Charts are responsive and tabs work perfectly on mobile,Great dashboard experience,src/pages/Dashboard.tsx
Frontend UI,Update,Login Forms,Improved sign-in and sign-up forms,We improved the sign-in and sign-up forms to work better on mobile,Completed,2024-12-05,Password fields now have show/hide buttons and real-time validation,Better form experience,src/components/AuthModal.tsx
Frontend UI,Update,Footer,Made footer smaller and simpler,We made the footer smaller and simpler,Completed,2024-12-05,Better spacing on mobile devices,Cleaner footer design,src/pages/Index.tsx
Frontend UI,New,Mobile Support,Ensured entire website works on mobile,We made sure the entire website works perfectly on mobile phones,Completed,2024-12-05,Everything adjusts automatically to fit different screen sizes,Perfect mobile experience,All frontend files
Frontend UI,Update,Buttons,Made buttons bigger and easier to tap,We made all buttons bigger and easier to tap on mobile phones,Completed,2024-12-05,Better touch response for mobile users,Easier to click buttons,All component files
Frontend UI,Update,Input Fields,Made form fields same size and aligned,We made all form fields the same size and properly aligned,Completed,2024-12-05,Consistent look across all forms,Consistent form design,All form components
Frontend UI,Update,Cards,Redesigned cards to be compact,We redesigned all cards to be more compact with better spacing,Completed,2024-12-05,Cards now look great on both desktop and mobile,Better card appearance,All card components
Frontend UI,Update,Text Sizes,Made text sizes responsive,We made all text sizes responsive so they look good on any device,Completed,2024-12-05,Text automatically adjusts based on screen size,Readable text on all devices,All page files
Frontend UI,Update,Color Theme,Kept consistent color scheme,We kept a consistent purple and blue color scheme throughout the website,Completed,2024-12-05,Beautiful glass-like effects and cosmic theme,Beautiful consistent design,All component files
Authentication,Removed,Login Requirement,Removed need to login,We removed the need to login - now everyone can use the website freely,Completed,2024-12-05,All pages are now accessible without creating an account,Everyone can use website freely,src/contexts/AuthContext.tsx
Authentication,Removed,Login Buttons,Removed login buttons from navbar,We removed all login and signup buttons from the navigation bar,Completed,2024-12-05,No more login prompts or user menus,Cleaner navigation bar,src/components/Navbar.tsx
Authentication,Removed,Protected Pages,Removed login check from pages,We removed the login check from all pages so anyone can access them,Completed,2024-12-05,Everything is now publicly available,All pages accessible,src/components/ProtectedRoute.tsx
Authentication,Removed,Login Prompts,Removed login messages,We removed all the Please login messages from all pages,Completed,2024-12-05,Users can now use Palm Reading Numerology and Astrology without logging in,No login interruptions,src/pages/PalmAnalysis.tsx src/pages/Numerology.tsx
Authentication,Removed,Auth System,Simplified authentication system,We simplified the authentication system to always allow access,Completed,2024-12-05,The system now treats everyone as logged in,System always allows access,src/contexts/AuthContext.tsx
Authentication,Removed,User Data,Removed need for user accounts,We removed the need for user accounts to use the dashboard,Completed,2024-12-05,Dashboard now works without requiring login,Dashboard accessible to all,src/pages/Dashboard.tsx
Feature Implementation,New,Palm Reading Feature,Added AI palm photo analysis,We added a feature where AI analyzes palm photos and gives readings,Completed,2024-12-05,Users can upload palm photos and get instant AI-powered analysis,Users get instant palm readings,src/components/PalmUpload.tsx
Feature Implementation,New,Camera Feature,Added ability to take palm photos,We added the ability to take palm photos directly with the camera,Completed,2024-12-05,Works on both desktop and mobile devices,Easy photo capture,src/components/PalmUpload.tsx
Feature Implementation,New,Gallery Upload,Added ability to upload from gallery,We added the ability to upload palm photos from the phone gallery,Completed,2024-12-05,Users can also drag and drop images,Multiple upload options,src/components/PalmUpload.tsx
Feature Implementation,New,Numerology Calculator,Built calculator for life path numbers,We built a calculator that finds life path destiny and soul numbers,Completed,2024-12-05,Shows results instantly with beautiful visuals,Instant numerology results,src/pages/Numerology.tsx
Feature Implementation,New,Astrology Form,Created step-by-step form,We created a step-by-step form to collect birth details for astrology readings,Completed,2024-12-05,Users fill out information in easy steps,Easy form filling,src/pages/AstrologyReading.tsx
Feature Implementation,New,Dashboard,Built dashboard for readings,We built a dashboard where users can see all their readings and statistics,Completed,2024-12-05,Updates automatically when new readings are saved,See all readings in one place,src/pages/Dashboard.tsx
Feature Implementation,New,Reading Storage,Ensured readings saved properly,We made sure all readings are saved in the database and never get overwritten,Completed,2024-12-05,Each reading has a unique ID so nothing gets lost,Readings are never lost,backend/readings/models.py
Feature Implementation,New,Real-time Updates,Made dashboard update instantly,We made the dashboard update instantly when a new reading is saved,Completed,2024-12-05,No need to refresh the page - updates happen automatically,Instant updates,src/pages/Dashboard.tsx
Feature Implementation,New,Progress Bars,Added progress bars for analysis,We added progress bars to show how much of the analysis is complete,Completed,2024-12-05,Smooth animations make it look professional,See analysis progress,All reading pages
Feature Implementation,New,Error Messages,Added clear error messages,We added clear error messages that tell users what went wrong,Completed,2024-12-05,Users get helpful notifications when something fails,Users know what went wrong,All components
Feature Implementation,New,Loading Screens,Added loading indicators,We added loading indicators so users know something is happening,Completed,2024-12-05,Better user experience during wait times,Better waiting experience,All components
Feature Implementation,New,Image Preview,Added ability to preview photos,We added the ability to see the palm photo before analyzing it,Completed,2024-12-05,Users can change the photo if they don't like it,Preview before analyzing,src/components/PalmUpload.tsx
Feature Implementation,New,Results Display,Created beautiful results display,We created a beautiful way to show reading results with animations,Completed,2024-12-05,Results appear smoothly with nice visual effects,Beautiful results display,src/components/PalmResults.tsx
Bug Fixes,Fixed,Camera Button,Fixed camera button to open camera,We fixed the camera button so it actually opens the camera instead of the gallery,Completed,2024-12-05,Now works correctly on both desktop and mobile,Camera works properly,src/components/PalmUpload.tsx
Bug Fixes,Fixed,Mobile Camera,Improved mobile camera access,We improved camera access on mobile phones with better error handling,Completed,2024-12-05,If camera doesn't work it falls back to gallery automatically,Reliable camera access,src/components/PalmUpload.tsx
Bug Fixes,Fixed,Database Connection,Added backup database system,We added a backup database system in case the main one fails,Completed,2024-12-05,Website keeps working even if database connection has issues,Website always works,backend/.env
Bug Fixes,Fixed,Text Sizing,Fixed all text sizes,We fixed all text sizes so they're readable but not too big,Completed,2024-12-05,Everything is now perfectly sized for easy reading,Perfect text readability,All page files
Bug Fixes,Fixed,Button Visibility,Made buttons clearly visible,We made sure all buttons are clearly visible and easy to click,Completed,2024-12-05,Better colors and sizes for better visibility,Easy to find buttons,All component files
Bug Fixes,Fixed,Mobile Layout,Fixed pages for mobile phones,We fixed all pages so they look perfect on mobile phones,Completed,2024-12-05,No more text overflow or layout issues,Perfect mobile layout,All page files
Bug Fixes,Fixed,Form Validation,Added real-time form checking,We added real-time checking of form inputs with helpful messages,Completed,2024-12-05,Users see immediately if their password is strong enough,Instant form feedback,src/components/AuthModal.tsx
Bug Fixes,Fixed,Error Messages,Made error messages clear,We made all error messages clear and helpful,Completed,2024-12-05,Users now know exactly what to do when something goes wrong,Clear error guidance,All components
Performance,Optimized,Animations,Simplified animations for speed,We simplified animations to make the website faster,Completed,2024-12-05,Removed heavy effects that were slowing things down,Faster website,All component files
Performance,Optimized,Image Loading,Made images load faster,We made images load faster and delete automatically after use,Completed,2024-12-05,Better performance and privacy,Faster image loading,src/components/PalmUpload.tsx
Performance,Optimized,Mobile Speed,Hid heavy animations on mobile,We hid heavy animations on mobile to make phones run faster,Completed,2024-12-05,Website now works smoothly even on older phones,Fast on mobile,All component files
Performance,Optimized,API Calls,Reduced unnecessary API calls,We reduced unnecessary API calls to make the website faster,Completed,2024-12-05,Only makes calls when really needed,Faster API responses,src/lib/apiService.ts
Performance,Optimized,File Size,Made website files smaller,We made the website files smaller so it loads faster,Completed,2024-12-05,Optimized code for faster loading times,Faster page loads,vite.config.ts
API Integration,New,OpenAI Vision,Connected OpenAI vision AI,We connected OpenAI's vision AI to analyze palm photos,Completed,2024-12-05,The AI can see and understand palm images,Accurate palm analysis,backend/readings/utils.py
API Integration,New,OpenAI Chat,Connected OpenAI chat AI,We connected OpenAI's chat AI for numerology and astrology readings,Completed,2024-12-05,The AI generates personalized readings based on user input,Personalized readings,backend/numerology/utils.py backend/astrology/utils.py
API Integration,New,Error Handling,Added smart error handling,We added smart error handling that tries again if something fails,Completed,2024-12-05,Website keeps working even if API has temporary issues,Reliable API calls,All API service files
API Integration,New,Request Limits,Added limits to prevent spam,We added limits to prevent people from making too many requests,Completed,2024-12-05,This keeps the website stable and prevents abuse,Stable website,backend/numerology/throttling.py
API Integration,New,Token Refresh,Added automatic token refresh,We added automatic token refresh so users stay logged in,Completed,2024-12-05,Tokens refresh automatically before they expire,Seamless user experience,src/lib/apiService.ts
Database,New,SQLite Database,Set up simple database file,We set up a simple database file that works immediately,Completed,2024-12-05,This is the default database that works out of the box,Works immediately,backend/db.sqlite3
Database,New,PostgreSQL Support,Added support for powerful database,We added support for a more powerful database system,Completed,2024-12-05,Can switch between databases easily,Flexible database options,backend/.env
Database,New,Data Tables,Created all needed tables,We created all the tables needed to store different types of information,Completed,2024-12-05,Tables for users readings numerology and astrology data,All data properly stored,All model files
Database,New,Migrations,Created database structure,We created all the database structure and applied it,Completed,2024-12-05,All tables are now set up and ready to use,Database ready to use,All migration files
Database,New,Data Safety,Ensured data saved properly,We made sure data is saved properly and never gets overwritten,Completed,2024-12-05,Each piece of data has a unique ID and is saved in order,Data never lost,All model files
Security,New,Image Privacy,Ensured photos deleted after use,We made sure palm photos are automatically deleted after analysis,Completed,2024-12-05,Privacy is our top priority - images don't stay on the server,User privacy protected,backend/readings/views_palm.py
Security,New,Input Protection,Added checks for bad input,We added checks to prevent bad or malicious input,Completed,2024-12-05,All forms validate input before processing,Secure input handling,All form components
Security,New,Connection Security,Configured secure connections,We configured secure connections between frontend and backend,Completed,2024-12-05,Only allowed websites can connect,Secure communication,backend/palmastro_backend/settings.py
Security,New,Secret Storage,Stored secrets in secure file,We store all passwords and API keys in a secure file,Completed,2024-12-05,This file is never shared or uploaded to the internet,Sensitive data protected,backend/.env
Documentation,New,Setup Guide,Created setup instructions,We created a guide explaining how to set up and run the project,Completed,2024-12-05,Step-by-step instructions for developers,Easy project setup,README.md
Documentation,New,API Guide,Created API documentation,We created documentation explaining how the API works,Completed,2024-12-05,Developers can see all available API endpoints,Clear API understanding,backend/palmastro_backend/settings.py
Documentation,New,Database Guide,Created database setup guide,We created a guide for setting up the database,Completed,2024-12-05,Instructions for both SQLite and PostgreSQL,Easy database setup,backend/DATABASE_SETUP.md
Documentation,New,Project Summary,Created project overview,We created a summary document explaining the entire project,Completed,2024-12-05,Complete overview of all features and how they work,Complete project understanding,PALM_ASTRO_PLATFORM_SUMMARY.md
Dependencies,New,Frontend Libraries,Added frontend libraries,We added all the necessary libraries for the website frontend,Completed,2024-12-05,React Vite TailwindCSS and animation libraries,Modern frontend tools,package.json
Dependencies,New,Backend Libraries,Added backend libraries,We added all the necessary libraries for the server,Completed,2024-12-05,Django OpenAI Celery and database libraries,Powerful backend tools,backend/requirements.txt
Dependencies,New,UI Components,Added UI component library,We added a library of beautiful and accessible UI components,Completed,2024-12-05,Pre-built components that work on all devices,Beautiful UI components,src/components/ui/
Dependencies,New,Animation Tools,Added animation libraries,We added animation libraries to make the website look smooth,Completed,2024-12-05,Professional animations that don't slow down the website,Smooth animations,package.json
Dependencies,New,3D Graphics,Added 3D graphics libraries,We added 3D graphics libraries for beautiful backgrounds,Completed,2024-12-05,Interactive 3D elements that make the website look amazing,Beautiful 3D effects,package.json
Testing,New,Unit Tests,Created function tests,We created tests to make sure important functions work correctly,Completed,2024-12-05,Automated tests that check if code is working,Reliable code,src/lib/utils.spec.ts
Testing,New,API Tests,Tested API endpoints,We tested all API endpoints to make sure they work properly,Completed,2024-12-05,Manual testing of all backend connections,Working API,All API test files
Deployment,New,Build System,Set up production build system,We set up the system to create optimized production builds,Completed,2024-12-05,Website files are optimized for fast loading,Fast production builds,vite.config.ts
Deployment,New,Docker Support,Added Docker support,We added Docker support so the website can run in containers,Completed,2024-12-05,Makes deployment easier and more consistent,Easy deployment,docker-compose.yml
Deployment,New,Environment Settings,Set up environment configuration,We set up different settings for development and production,Completed,2024-12-05,Website behaves differently in testing vs live environment,Proper environment setup,backend/.env
